{
  "recent": [
    {
      "at": "2026-02-14T02:39:28.807Z",
      "runId": "acute-chest-pain-differential-in-urgent-care-stjz5ikt",
      "key": "hospital procedural|ICU during a storm-induced power flicker|a confusing medication list|the obvious diagnosis is wrong|an annotated pocket guideline card|pattern recognition,countdown clocks,signal vs noise",
      "variety": {
        "genre_wrapper": "hospital procedural",
        "body_setting": "ICU during a storm-induced power flicker",
        "antagonist_archetype": "a confusing medication list",
        "twist_type": "the obvious diagnosis is wrong",
        "signature_gadget": "an annotated pocket guideline card",
        "motifs": [
          "pattern recognition",
          "countdown clocks",
          "signal vs noise"
        ]
      },
      "story_fingerprint": "During a storm-flickering ICU overflow that’s triaging urgent-care chest pain, felt detectives Cyto Kine and Deputy Pip shrink into the thorax to run a killers-first investigation—only to learn the “obvious” benign culprit is wrong, and the real threat is an invisible pulmonary highway blockade revealed by probability-based warrants, serial evidence, and a clean-but-misleading chest X-ray. | Macro: a hospital procedural vibe—urgent-care chest pain is being routed through an ICU-adjacent triage bay during a storm-induced power flicker; monitors blink, printers jam, and handoffs are noisy. Micro: an anatomically accurate 3D thorax ‘city’ (ribs/intercostals/pleura, pericardium, coronary arteries, aorta layers, pulmonary arteries and alveoli-capillary interface) lit by intermittent emergency lighting and Cyto’s HUD glow. Antagonist pressure: a confusing medication list that keeps trying to ‘solve’ the case prematurely (duplicate nitrates, missing anticoagulant history, unclear PDE-5 use, mislabeled aspirin allergy), creating signal-vs-noise traps. | Detective Cyto Kine — felt lead investigator with HUD visor and evidence vial; noir radio-drama narration that turns physiology into infrastructure., Deputy Pip — felt field deputy with micro-scanner; earnest chaos probe who asks learner-questions and triggers clue reveals without being incompetent., Urgent-Care Charge RN (supporting) — protocol anchor managing triage under storm flicker; pushes ABCs/ECG-first., ICU Float Pharmacist (supporting) — trying to reconcile a chaotic med list; not villainous, but the list itself is the antagonist., The Patient (adult, anonymized, respected) — acute chest pain + dyspnea; anxious but cooperative; physiology is the true ‘crime scene.’, ICD (Internal Calamity Directorate) — breadcrumb only: a too-clean ‘Protocol Patch’ watermark appears on the pocket guideline card’s laminate and on the med-rec printout header. | If Cyto and Pip anchor on a benign label (GERD/MSK/anxiety) or let the confusing medication list drive unsafe empiric treatment, they miss a time-sensitive killer (ACS/PE/dissection/tension PTX/tamponade). The host can deteriorate during the storm flicker—hypoxemia worsens, RV strain escalates, or a dissection is anticoagulated—turning a triage decision into preventable catastrophe. Win condition: safe disposition (transfer when needed), correct first-5-min actions, and explicit safety-netting that acknowledges early-test limits.",
      "cast": [
        "Detective Cyto Kine — felt lead investigator with HUD visor and evidence vial; noir radio-drama narration that turns physiology into infrastructure.",
        "Deputy Pip — felt field deputy with micro-scanner; earnest chaos probe who asks learner-questions and triggers clue reveals without being incompetent.",
        "Urgent-Care Charge RN (supporting) — protocol anchor managing triage under storm flicker; pushes ABCs/ECG-first.",
        "ICU Float Pharmacist (supporting) — trying to reconcile a chaotic med list; not villainous, but the list itself is the antagonist.",
        "The Patient (adult, anonymized, respected) — acute chest pain + dyspnea; anxious but cooperative; physiology is the true ‘crime scene.’",
        "ICD (Internal Calamity Directorate) — breadcrumb only: a too-clean ‘Protocol Patch’ watermark appears on the pocket guideline card’s laminate and on the med-rec printout header."
      ]
    },
    {
      "at": "2026-02-14T00:54:23.436Z",
      "runId": "heart-failure-vdqe6jf1",
      "key": "techno-thriller|pre-op holding area with conflicting histories|a time-critical lab delay|the test result is a red herring|a whiteboard of shifting differentials|countdown clocks,countdown clocks,team handoffs",
      "variety": {
        "genre_wrapper": "techno-thriller",
        "body_setting": "pre-op holding area with conflicting histories",
        "antagonist_archetype": "a time-critical lab delay",
        "twist_type": "the test result is a red herring",
        "signature_gadget": "a whiteboard of shifting differentials",
        "motifs": [
          "countdown clocks",
          "countdown clocks",
          "team handoffs"
        ]
      },
      "story_fingerprint": "In a countdown-driven techno-thriller set in a pre-op holding area with conflicting histories, Detective Cyto Kine and Deputy Pip shrink into Cardio City to solve a “pressure–flow” crime: the patient isn’t primarily starving for output—he’s drowning in filling pressure. A time-critical lab delay threatens to mislead the team, and a red-herring test result nearly derails the case until Cyto proves the real culprit is congestion from heart failure, triggered by a preventable precipitant, and the only true arrest is two-part—acute decongestion plus long-term takedown of the SNS/RAAS protection racket with guideline-directed therapy. | Macro: Pre-op holding area minutes before surgery, with rapid team handoffs, incomplete med reconciliation, and a ticking OR schedule. Micro: Cardio City’s pump station (LV/RV), pulmonary venous ‘waterfront’ (alveoli-capillary interface), venous ‘pressure gauge’ district (IJ/JVP), and the Echo Courtroom (TTE imaging space). Tone: noir narration inside a techno-thriller countdown. | Detective Cyto Kine — felt lead investigator with HUD visor and evidence vial; narrates physiology as noir infrastructure., Deputy Pip — felt field deputy with micro-scanner; earnest chaos probe who triggers clue reveals without being incompetent., Pre-op Charge RN — protocol anchor managing handoffs and the OR countdown; not villainous., Anesthesiology Resident — focused on immediate airway/hemodynamics; pushes for fast clearance., Hospitalist/IM Consult — balancing differential and disposition; wants objective evidence., The Patient (adult, respected, anonymized) — progressive dyspnea/orthopnea/edema discovered during pre-op evaluation., Antagonist archetype: Time-critical lab delay — BNP/chemistry results stuck in the tube system, forcing decisions under uncertainty., ICD (Internal Calamity Directorate) — breadcrumb only: a too-clean “Delay Protocol Patch” watermark appears on the lab-tracking HUD feed. | If Cyto and Pip misclassify the syndrome (e.g., treat as primary lung disease or ‘just anxiety’) or wait on delayed labs, the patient can tip into acute pulmonary edema or cardiogenic shock during induction—turning a routine surgery into a preventable catastrophe. Win condition: separate congestion vs perfusion, rule out dangerous mimics, identify phenotype and trigger, stabilize/decongest safely, and leave a relapse-prevention system that prevents rehospitalization.",
      "cast": [
        "Detective Cyto Kine — felt lead investigator with HUD visor and evidence vial; narrates physiology as noir infrastructure.",
        "Deputy Pip — felt field deputy with micro-scanner; earnest chaos probe who triggers clue reveals without being incompetent.",
        "Pre-op Charge RN — protocol anchor managing handoffs and the OR countdown; not villainous.",
        "Anesthesiology Resident — focused on immediate airway/hemodynamics; pushes for fast clearance.",
        "Hospitalist/IM Consult — balancing differential and disposition; wants objective evidence.",
        "The Patient (adult, respected, anonymized) — progressive dyspnea/orthopnea/edema discovered during pre-op evaluation.",
        "Antagonist archetype: Time-critical lab delay — BNP/chemistry results stuck in the tube system, forcing decisions under uncertainty.",
        "ICD (Internal Calamity Directorate) — breadcrumb only: a too-clean “Delay Protocol Patch” watermark appears on the lab-tracking HUD feed."
      ]
    },
    {
      "at": "2026-02-13T23:50:58.160Z",
      "runId": "hypertension-in-primary-care-evaluation-and-mana-uzauour0",
      "key": "hospital procedural|overnight ED shift|a hidden comorbidity|a vital clue was overlooked in plain sight|a suspiciously pristine chart printout|false reassurance,protocol vs intuition,hidden constraints",
      "variety": {
        "genre_wrapper": "hospital procedural",
        "body_setting": "overnight ED shift",
        "antagonist_archetype": "a hidden comorbidity",
        "twist_type": "a vital clue was overlooked in plain sight",
        "signature_gadget": "a suspiciously pristine chart printout",
        "motifs": [
          "false reassurance",
          "protocol vs intuition",
          "hidden constraints"
        ]
      }
    },
    {
      "at": "2026-02-13T23:38:24.834Z",
      "runId": "ENnuWG3uWzvK",
      "key": "small-town mystery|busy urgent care in flu season|a confusing medication list|the patient decompensates during a key decision|a pager that never stops|false reassurance,team handoffs,false reassurance",
      "variety": {
        "genre_wrapper": "small-town mystery",
        "body_setting": "busy urgent care in flu season",
        "antagonist_archetype": "a confusing medication list",
        "twist_type": "the patient decompensates during a key decision",
        "signature_gadget": "a pager that never stops",
        "motifs": [
          "false reassurance",
          "team handoffs",
          "false reassurance"
        ]
      },
      "story_fingerprint": "When a case arrives labeled only “E2E rerun parent 1771024054717,” Detective Cyto Kine treats it like a forged warrant—refusing to invent a diagnosis—until a near-miss decompensation in a flu-season urgent care proves why primary-care safety depends on structured triage, mechanism-based reasoning, and a mandatory Topic Intake Checklist before any disease-specific chase begins. | A small-town urgent care during peak flu season—crowded waiting room, constant handoffs, and a pager that never stops. The ‘micro-world’ is a stylized Intake Terminal inside the clinic’s workflow system that can ‘shrink’ Cyto and Pip into a neutral Body City diorama for universal clinical frameworks (no diagnosis-specific anatomy until a real topic exists). | Detective Cyto Kine — felt lead investigator with HUD visor, evidence vial; noir radio-drama narration, Deputy Pip — felt field deputy with micro-scanner; earnest chaos probe who asks learner-questions, Urgent Care Charge RN — competent protocol anchor managing triage and handoffs (supporting), Front Desk/Registrar — well-meaning but rushed; the source of the bare ID slip (supporting), The Patient Avatar — respectful, anonymized silhouette representing ‘a real patient’ who could be harmed by speculative medicine, Antagonist archetype: A confusing medication list — duplications/omissions that create false reassurance and unsafe empiric choices, ICD (Internal Calamity Directorate) — breadcrumb only: a too-clean metadata watermark embedded in the intake ID string | If Cyto and Pip treat an internal tracking label as a clinical entity, they’ll trigger a shotgun workup, unsafe empiric meds (interaction/allergy/QT/renal risks), missed red flags, and a preventable deterioration during a key decision—turning workflow noise into patient harm. The win condition is stopping speculation, triaging correctly, and building a reusable PCP framework plus a Topic Intake Checklist that prevents future ‘non-cases’ from entering the diagnostic pipeline.",
      "cast": [
        "Detective Cyto Kine — felt lead investigator with HUD visor, evidence vial; noir radio-drama narration",
        "Deputy Pip — felt field deputy with micro-scanner; earnest chaos probe who asks learner-questions",
        "Urgent Care Charge RN — competent protocol anchor managing triage and handoffs (supporting)",
        "Front Desk/Registrar — well-meaning but rushed; the source of the bare ID slip (supporting)",
        "The Patient Avatar — respectful, anonymized silhouette representing ‘a real patient’ who could be harmed by speculative medicine",
        "Antagonist archetype: A confusing medication list — duplications/omissions that create false reassurance and unsafe empiric choices",
        "ICD (Internal Calamity Directorate) — breadcrumb only: a too-clean metadata watermark embedded in the intake ID string"
      ]
    },
    {
      "at": "2026-02-13T23:35:44.892Z",
      "runId": "hypertension-in-primary-care-evaluation-and-mana-gyxk1jhi",
      "key": "techno-thriller|busy urgent care in flu season|an overconfident consultant|the obvious diagnosis is wrong|a battered pocket ultrasound|protocol vs intuition,false reassurance,hidden constraints",
      "variety": {
        "genre_wrapper": "techno-thriller",
        "body_setting": "busy urgent care in flu season",
        "antagonist_archetype": "an overconfident consultant",
        "twist_type": "the obvious diagnosis is wrong",
        "signature_gadget": "a battered pocket ultrasound",
        "motifs": [
          "protocol vs intuition",
          "false reassurance",
          "hidden constraints"
        ]
      },
      "story_fingerprint": "During a flu-season crush at a busy urgent care, Detective Cyto Kine and Deputy Pip chase a “Silent Pressure Syndicate” that’s vandalizing the body’s vascular city—only to learn the obvious culprit (a scary office BP) is sometimes a decoy, and the real case hinges on clean measurement, out-of-office surveillance, targeted secondary-cause interrogations, and a stepwise long-game takedown that prevents future MI, stroke, HF, and CKD. | Techno-thriller wrapper set in a busy urgent care during flu season: crowded waiting room, constant interruptions, and an overconfident consultant pushing shortcuts. Micro-world locations include the brachial artery “interrogation room,” arteriolar “choke-point streets,” the kidney “Water Authority,” the heart “Pump Station,” the retina “camera grid,” and the glomerulus “archive filters.” | Detective Cyto Kine (felt lead investigator; HUD visor; evidence vial; noir-radio narration), Deputy Pip (felt field deputy; micro-scanner; earnest chaos probe), Dr. Voss (overconfident consultant; antagonist archetype; insists ‘numbers are numbers’ and pushes rapid fixes), Urgent Care Charge RN (protocol anchor; keeps triage moving; not villainous), The Patient (adult, respected; here for flu-like symptoms; ‘feels fine’ re: BP), ICD (Internal Calamity Directorate) presence (breadcrumb only): a too-clean “BP Protocol Patch” watermark that appears on the HUD evidence chain | If Cyto and Pip mis-handle the evidence (bad cuff/technique, no ABPM/HBPM confirmation, anchoring on symptoms), the patient is either falsely labeled/overtreated (hypotension, AKI, side effects) or undertreated (silent progression to LVH, stroke, CKD, retinopathy). A wrong move during a severe-reading standoff risks hypoperfusion from overly rapid BP reduction; a missed emergency risks acute end-organ injury.",
      "cast": [
        "Detective Cyto Kine (felt lead investigator; HUD visor; evidence vial; noir-radio narration)",
        "Deputy Pip (felt field deputy; micro-scanner; earnest chaos probe)",
        "Dr. Voss (overconfident consultant; antagonist archetype; insists ‘numbers are numbers’ and pushes rapid fixes)",
        "Urgent Care Charge RN (protocol anchor; keeps triage moving; not villainous)",
        "The Patient (adult, respected; here for flu-like symptoms; ‘feels fine’ re: BP)",
        "ICD (Internal Calamity Directorate) presence (breadcrumb only): a too-clean “BP Protocol Patch” watermark that appears on the HUD evidence chain"
      ]
    },
    {
      "at": "2026-02-13T20:49:51.873Z",
      "runId": "eEH1E9OK0hW1",
      "key": "courtroom thriller|overnight ED shift|a hidden comorbidity|the patient decompensates during a key decision|a pager that never stops|signal vs noise,protocol vs intuition,protocol vs intuition",
      "variety": {
        "genre_wrapper": "courtroom thriller",
        "body_setting": "overnight ED shift",
        "antagonist_archetype": "a hidden comorbidity",
        "twist_type": "the patient decompensates during a key decision",
        "signature_gadget": "a pager that never stops",
        "motifs": [
          "signal vs noise",
          "protocol vs intuition",
          "protocol vs intuition"
        ]
      },
      "story_fingerprint": "On an overnight ED shift framed as a courtroom thriller, Detective Cyto Kine and Deputy Pip prosecute “The Sugar Exposure Case,” proving that chronic hyperglycemia—amplified by a hidden comorbidity—quietly sabotages the body’s microvascular backstreets and macrovascular highways, until the patient decompensates mid-decision and forces a protocol-first sprint from surveillance to rescue to long-term prevention. | Courtroom-thriller wrapper inside an overnight ED shift: the ED becomes the “court,” while Cyto and Pip shrink into anatomically accurate 3D body districts (retina, glomerulus, vasa nervorum, coronary/PAD highways, plantar foot) to gather admissible evidence. The signature gadget is a pager that never stops, driving rapid triage and time-stamped HUD ‘exhibits.’ Motifs: signal vs noise; protocol vs intuition. | Detective Cyto Kine — felt lead investigator with HUD visor and evidence vial; narrates physiology as infrastructure and courtroom evidence., Deputy Pip — felt field deputy with micro-scanner; action-forward, asks learner questions, triggers clue reveals through curiosity without being incompetent., ED Charge Nurse (supporting) — embodies protocol under pressure; keeps the ‘court’ moving during the night shift., The Patient (adult with diabetes, respected) — initially stable with subtle complaints; later decompensates during a key decision point., Antagonist archetype: a hidden comorbidity — chronic kidney impairment/volume depletion/NSAID exposure (kept ambiguous early) that distorts signals, raises hypoglycemia risk, and accelerates vascular injury., ICD (Internal Calamity Directorate) — faint breadcrumb: a standardized “Basement Membrane” stamp appears in multiple ‘exhibits’ on the HUD, hinting at a larger conspiracy. | If Cyto and Pip misread noisy ED data and skip systematic surveillance, the patient risks preventable blindness (retinopathy), irreversible kidney decline (DKD), limb-threatening infection/Charcot collapse (foot disease), and fatal macrovascular events—while acute hypoglycemia/AKI can trigger immediate harm during the shift. Winning requires triage-first action, correct workup checklists, and a prevention bundle that prioritizes hypoglycemia safety and organ protection.",
      "cast": [
        "Detective Cyto Kine — felt lead investigator with HUD visor and evidence vial; narrates physiology as infrastructure and courtroom evidence.",
        "Deputy Pip — felt field deputy with micro-scanner; action-forward, asks learner questions, triggers clue reveals through curiosity without being incompetent.",
        "ED Charge Nurse (supporting) — embodies protocol under pressure; keeps the ‘court’ moving during the night shift.",
        "The Patient (adult with diabetes, respected) — initially stable with subtle complaints; later decompensates during a key decision point.",
        "Antagonist archetype: a hidden comorbidity — chronic kidney impairment/volume depletion/NSAID exposure (kept ambiguous early) that distorts signals, raises hypoglycemia risk, and accelerates vascular injury.",
        "ICD (Internal Calamity Directorate) — faint breadcrumb: a standardized “Basement Membrane” stamp appears in multiple ‘exhibits’ on the HUD, hinting at a larger conspiracy."
      ]
    },
    {
      "at": "2026-02-12T18:35:56.315Z",
      "runId": "_1K3Ykw3JkXG",
      "key": "medical noir|overnight ED shift|a confusing medication list|the obvious diagnosis is wrong|a battered pocket ultrasound|false reassurance,protocol vs intuition,protocol vs intuition",
      "variety": {
        "genre_wrapper": "medical noir",
        "body_setting": "overnight ED shift",
        "antagonist_archetype": "a confusing medication list",
        "twist_type": "the obvious diagnosis is wrong",
        "signature_gadget": "a battered pocket ultrasound",
        "motifs": [
          "false reassurance",
          "protocol vs intuition",
          "protocol vs intuition"
        ]
      },
      "story_fingerprint": "On an overnight ED shift, Detective Cyto Kine and Deputy Pip chase a “diabetes complications” case through the body’s microvascular back-alleys—until a confusing medication list frames the wrong culprit, and only a battered pocket ultrasound plus disciplined protocol can reveal what’s really driving the patient’s crisis and long-term risk. | Medical noir wrapped around an overnight ED shift that alternates between macro ED scenes (triage bay, charting station, medication reconciliation chaos) and micro-scale body “city” scenes inside capillary beds, retina, glomerulus, and foot microcirculation. The Mission HUD overlay timestamps the night; body-map transitions jump kidney → eye → foot → ED resuscitation bay. Visual motifs: rain-on-neon reflections in capillary ‘streets,’ thickened ‘walls,’ and subtle ‘leaks’ as permeability cues—no gore, patient respected. | Detective Cyto Kine — felt noir investigator with HUD visor and evidence vial; narrates physiology as infrastructure and evidence., Deputy Pip — felt field deputy with micro-scanner gadget; action-forward, asks learner questions, spots cognitive traps without being incompetent., ED Charge Nurse — competent, fast; embodies protocol under pressure., Resident/PA in triage — juggling orders, tempted by shortcuts; not villainous., The Patient (adult with diabetes) — respected; presents overnight with concerning symptoms and later a hyperglycemic crisis workup., Antagonist (archetype): A confusing medication list — duplications, omissions, and mismatched doses that create false reassurance and misdirection., ICD (Internal Calamity Directorate) — faint breadcrumb: an oddly standardized med-rec template code that keeps reappearing in the HUD’s ‘CLUE FOUND’ box. | If Cyto and Pip accept the medication list’s false reassurance and anchor on the obvious diagnosis, the team misses the correct diabetes complication pathway (microvascular screening gaps and/or DKA vs HHS distinction), delaying the right workup and first-step treatment—risking preventable vision loss, kidney decline, foot catastrophe, or deterioration during a hyperglycemic crisis. The win condition is structured screening + correct crisis differentiation + protocol-first stabilization, then long-term risk reduction.",
      "cast": [
        "Detective Cyto Kine — felt noir investigator with HUD visor and evidence vial; narrates physiology as infrastructure and evidence.",
        "Deputy Pip — felt field deputy with micro-scanner gadget; action-forward, asks learner questions, spots cognitive traps without being incompetent.",
        "ED Charge Nurse — competent, fast; embodies protocol under pressure.",
        "Resident/PA in triage — juggling orders, tempted by shortcuts; not villainous.",
        "The Patient (adult with diabetes) — respected; presents overnight with concerning symptoms and later a hyperglycemic crisis workup.",
        "Antagonist (archetype): A confusing medication list — duplications, omissions, and mismatched doses that create false reassurance and misdirection.",
        "ICD (Internal Calamity Directorate) — faint breadcrumb: an oddly standardized med-rec template code that keeps reappearing in the HUD’s ‘CLUE FOUND’ box."
      ]
    },
    {
      "at": "2026-02-11T18:57:59.574Z",
      "runId": "ZS05BWNWd3r8",
      "key": "techno-thriller|rural clinic with limited resources|a hidden comorbidity|two conditions are happening at once|a suspiciously pristine chart printout|misdirection,protocol vs intuition,misdirection",
      "variety": {
        "genre_wrapper": "techno-thriller",
        "body_setting": "rural clinic with limited resources",
        "antagonist_archetype": "a hidden comorbidity",
        "twist_type": "two conditions are happening at once",
        "signature_gadget": "a suspiciously pristine chart printout",
        "motifs": [
          "misdirection",
          "protocol vs intuition",
          "misdirection"
        ]
      },
      "story_fingerprint": "In a resource-limited rural clinic, Detective Cyto Kine and Deputy Pip chase a techno-thriller “signal” of fading perfusion in a febrile child—only to discover a hidden comorbidity is masking sepsis while a second condition unfolds in parallel, forcing an ABCD-first stabilization sprint guided by objective trends, not vibes. | A rural clinic with limited resources: one quiet exam room, a small lab corner, intermittent printer access, and a single “suspiciously pristine chart printout” that keeps appearing at key moments. Macro scenes show the clinic’s constrained reality; micro scenes shrink into the child’s capillary beds, endothelium, and microcirculation—rendered as a neon-lit infrastructure grid where flow, leak, and microthrombi read like a city under cyber-attack. | Detective Cyto Kine — felt noir investigator with HUD visor and evidence vial; narrates physiology as infrastructure under stress., Deputy Pip — felt field deputy with micro-scanner; action-forward, asks the learner’s questions, spots trend changes and cognitive traps., The Child Patient — respected; initially “just fever,” then subtle perfusion/mentation changes., Caregiver — worried but reassured by normal-looking numbers; provides key history when prompted., Rural Clinic Team (RN/MA/clinician) — competent, juggling constraints; embodies protocol vs intuition tension., Antagonist (archetype): Hidden comorbidity — a quiet baseline vulnerability that misdirects interpretation of vitals/exam., ICD (Internal Calamity Directorate) — faint breadcrumb via an unnaturally perfect printout header/footer code and checklist formatting that feels ‘too clean’ for the clinic printer. | If Cyto and Pip accept the pristine printout’s false reassurance and wait for hypotension, the child’s compensated shock will tip into decompensation before transfer—turning a treatable infection into preventable multi-organ dysfunction. The only way out is disciplined ABCD assessment, minimum objective dataset, rapid reassessment loops, and early treatment/escalation despite limited resources.",
      "cast": [
        "Detective Cyto Kine — felt noir investigator with HUD visor and evidence vial; narrates physiology as infrastructure under stress.",
        "Deputy Pip — felt field deputy with micro-scanner; action-forward, asks the learner’s questions, spots trend changes and cognitive traps.",
        "The Child Patient — respected; initially “just fever,” then subtle perfusion/mentation changes.",
        "Caregiver — worried but reassured by normal-looking numbers; provides key history when prompted.",
        "Rural Clinic Team (RN/MA/clinician) — competent, juggling constraints; embodies protocol vs intuition tension.",
        "Antagonist (archetype): Hidden comorbidity — a quiet baseline vulnerability that misdirects interpretation of vitals/exam.",
        "ICD (Internal Calamity Directorate) — faint breadcrumb via an unnaturally perfect printout header/footer code and checklist formatting that feels ‘too clean’ for the clinic printer."
      ]
    },
    {
      "at": "2026-02-11T18:46:53.448Z",
      "runId": "iR6p-LFWSzhJ",
      "key": "medical noir|ambulance ride with a deteriorating patient|an overconfident consultant|the patient decompensates during a key decision|a battered pocket ultrasound|hidden constraints,protocol vs intuition,protocol vs intuition",
      "variety": {
        "genre_wrapper": "medical noir",
        "body_setting": "ambulance ride with a deteriorating patient",
        "antagonist_archetype": "an overconfident consultant",
        "twist_type": "the patient decompensates during a key decision",
        "signature_gadget": "a battered pocket ultrasound",
        "motifs": [
          "hidden constraints",
          "protocol vs intuition",
          "protocol vs intuition"
        ]
      },
      "story_fingerprint": "During an ambulance ride from urgent care, Detective Cyto Kine and Deputy Pip race through a medical-noir “four killers” case—until an overconfident consultant pushes a shortcut and the patient decompensates mid-decision, forcing Cyto to prove that protocol beats vibes when chest pain is on the line. | A rain-streaked, siren-lit ambulance interior rendered in Pixar-like 3D, with Cyto and Pip as felt detectives shrinking between macro scenes (stretcher, monitor glow, paramedic hands) and micro scenes inside the thorax (RBCs rushing like traffic, pleura sliding like wet pavement, coronary arteries as narrow alleyways). The Mission HUD overlay ticks like a metronome; body-map transitions jump between chest wall, lungs/pleura, heart/pericardium, and aorta. | Detective Cyto Kine — felt noir investigator with HUD visor and evidence vial; narrates physiology as city infrastructure., Deputy Pip — felt field deputy with micro-scanner; action-forward, asks the learner’s questions, spots cognitive traps., The Patient (adult, respected) — acute chest pain; initially stable, then deteriorates at the worst moment., Paramedic Team — competent, calm; provides the real-world urgent-care-to-EMS bridge., The Antagonist: an overconfident consultant — remote voice on speakerphone insisting the pain is ‘obviously musculoskeletal’ and urging delay/shortcut., ICD (Internal Calamity Directorate) — faint breadcrumb via a coded transfer form stamp and a suspiciously “too-neat” checklist. | If Cyto and Pip let a single reassuring feature (reproducible tenderness, ‘sharp’ description, a normal-looking first snapshot) override structured triage, they miss a time-sensitive killer (ACS/PE/dissection/pneumothorax) and the patient crashes before definitive care—turning a routine urgent-care chest pain visit into a preventable catastrophe and advancing the ICD’s larger pattern of hidden constraints.",
      "cast": [
        "Detective Cyto Kine — felt noir investigator with HUD visor and evidence vial; narrates physiology as city infrastructure.",
        "Deputy Pip — felt field deputy with micro-scanner; action-forward, asks the learner’s questions, spots cognitive traps.",
        "The Patient (adult, respected) — acute chest pain; initially stable, then deteriorates at the worst moment.",
        "Paramedic Team — competent, calm; provides the real-world urgent-care-to-EMS bridge.",
        "The Antagonist: an overconfident consultant — remote voice on speakerphone insisting the pain is ‘obviously musculoskeletal’ and urging delay/shortcut.",
        "ICD (Internal Calamity Directorate) — faint breadcrumb via a coded transfer form stamp and a suspiciously “too-neat” checklist. "
      ]
    },
    {
      "at": "2026-02-11T18:33:21.103Z",
      "runId": "i6ZkWlizpYUV",
      "key": "classic whodunit|ICU during a storm-induced power flicker|a misleading device reading|the patient decompensates during a key decision|a pager that never stops|false reassurance,false reassurance,countdown clocks",
      "variety": {
        "genre_wrapper": "classic whodunit",
        "body_setting": "ICU during a storm-induced power flicker",
        "antagonist_archetype": "a misleading device reading",
        "twist_type": "the patient decompensates during a key decision",
        "signature_gadget": "a pager that never stops",
        "motifs": [
          "false reassurance",
          "false reassurance",
          "countdown clocks"
        ]
      },
      "story_fingerprint": "During a storm-flickering ICU consult that bleeds into urgent-care triage, Detective Cyto Kine and Deputy Pip run a classic whodunit where the “killer” isn’t a disease at first—it’s a misleading device reading—until the patient suddenly decompensates mid-decision, forcing a countdown-driven, killers-first chest pain differential and transfer plan. | A storm-induced power flicker rolls through a hospital ICU that’s temporarily acting as overflow triage for urgent-care chest pain calls; monitors blink, hallway lights stutter, and the Mission HUD overlay keeps time like a metronome. Cyto and Pip shrink into the patient’s thorax—anatomically accurate heart, pleura, pericardium, esophagus, and chest wall rendered in Pixar-like 3D—while they remain felt, lit by intermittent emergency lighting and the glow of their HUD visor and micro-scanner. | Detective Cyto Kine — felt noir investigator with HUD visor and evidence vial; narrates observations as physiology metaphors., Deputy Pip — felt field deputy with micro-scanner; asks the learner’s questions and pushes the action without being incompetent., The Patient (adult, respected) — acute chest pain presentation; becomes the stakes when physiology turns., ICD (Internal Calamity Directorate) — background conspiracy presence; hinted via anomalous device behavior and paperwork codes., The Antagonist: a misleading device reading — a pulse-ox/monitor value that offers false reassurance at the worst moment., Signature prop: a pager that never stops — relentless alerts that enforce the countdown-clock motif and drive rapid decisions. | If Cyto and Pip let false reassurance steer the workup, a time-sensitive killer (ACS/PE/dissection/pneumothorax/pericarditis-myocarditis) is missed; the patient decompensates during a key decision, and the team must choose the correct urgent-care action—ECG now, probability-based PE pathway, repeat testing/transfer—before the clock runs out.",
      "cast": [
        "Detective Cyto Kine — felt noir investigator with HUD visor and evidence vial; narrates observations as physiology metaphors.",
        "Deputy Pip — felt field deputy with micro-scanner; asks the learner’s questions and pushes the action without being incompetent.",
        "The Patient (adult, respected) — acute chest pain presentation; becomes the stakes when physiology turns.",
        "ICD (Internal Calamity Directorate) — background conspiracy presence; hinted via anomalous device behavior and paperwork codes.",
        "The Antagonist: a misleading device reading — a pulse-ox/monitor value that offers false reassurance at the worst moment.",
        "Signature prop: a pager that never stops — relentless alerts that enforce the countdown-clock motif and drive rapid decisions."
      ]
    }
  ]
}
